[
  {
    "question_id": "phy-q-001",
    "exam": "NEET",
    "subject": "Physics",
    "unit": "Kinematics",
    "chapter": "Kinematics",
    "chapter_id": "phy-kinematics",
    "topic": "Kinematics",
    "type": "MCQ_SINGLE",
    "difficulty": "EASY",
    "question_text": "A body starts from rest and moves with uniform acceleration of 2 m/s². Distance covered in 5th second is:",
    "options": [
      "9 m",
      "10 m",
      "11 m",
      "12 m"
    ],
    "correct_answer": "9 m",
    "explanation": "S_n = u + a(2n-1)/2 = 0 + 2(9)/2 = 9 m",
    "is_pyq": false,
    "pyq_year": null,
    "image_url": null
  },
  {
    "question_id": "phy-q-002",
    "exam": "NEET",
    "subject": "Physics",
    "unit": "Kinematics",
    "chapter": "Kinematics",
    "chapter_id": "phy-kinematics",
    "topic": "Kinematics",
    "type": "MCQ_SINGLE",
    "difficulty": "EASY",
    "question_text": "A projectile is fired at 45° to the horizontal. The ratio of range to maximum height is:",
    "options": [
      "4:1",
      "2:1",
      "1:2",
      "1:4"
    ],
    "correct_answer": "4:1",
    "explanation": "R = u²sin90°/g, H = u²sin²45°/2g → R/H = 4",
    "is_pyq": false,
    "pyq_year": null,
    "image_url": null
  },
  {
    "question_id": "phy-q-003",
    "exam": "NEET",
    "subject": "Physics",
    "unit": "Kinematics",
    "chapter": "Kinematics",
    "chapter_id": "phy-kinematics",
    "topic": "Kinematics",
    "type": "MCQ_SINGLE",
    "difficulty": "EASY",
    "question_text": "Which of the following is a scalar quantity?",
    "options": [
      "Displacement",
      "Velocity",
      "Speed",
      "Acceleration"
    ],
    "correct_answer": "Speed",
    "explanation": "Speed has magnitude only; displacement, velocity, acceleration are vectors.",
    "is_pyq": false,
    "pyq_year": null,
    "image_url": null
  },
  {
    "question_id": "phy-q-004",
    "exam": "NEET",
    "subject": "Physics",
    "unit": "Kinematics",
    "chapter": "Kinematics",
    "chapter_id": "phy-kinematics",
    "topic": "Kinematics",
    "type": "MCQ_SINGLE",
    "difficulty": "EASY",
    "question_text": "A particle moves in a circle of radius r. After half a revolution, the ratio of displacement to distance is:",
    "options": [
      "2/π",
      "π/2",
      "1/π",
      "π"
    ],
    "correct_answer": "2/π",
    "explanation": "Displacement = 2r (diameter), Distance = πr → ratio = 2r/πr = 2/π",
    "is_pyq": false,
    "pyq_year": null,
    "image_url": null
  },
  {
    "question_id": "phy-q-005",
    "exam": "NEET",
    "subject": "Physics",
    "unit": "Kinematics",
    "chapter": "Kinematics",
    "chapter_id": "phy-kinematics",
    "topic": "Kinematics",
    "type": "MCQ_SINGLE",
    "difficulty": "EASY",
    "question_text": "A car accelerates from 10 m/s to 30 m/s in 5 s. The acceleration is:",
    "options": [
      "2 m/s²",
      "4 m/s²",
      "6 m/s²",
      "8 m/s²"
    ],
    "correct_answer": "4 m/s²",
    "explanation": "a = (v-u)/t = (30-10)/5 = 4 m/s²",
    "is_pyq": false,
    "pyq_year": null,
    "image_url": null
  },
  {
    "question_id": "phy-q-006",
    "exam": "NEET",
    "subject": "Physics",
    "unit": "Kinematics",
    "chapter": "Kinematics",
    "chapter_id": "phy-kinematics",
    "topic": "Kinematics",
    "type": "MCQ_SINGLE",
    "difficulty": "EASY",
    "question_text": "A stone is thrown vertically upward with initial velocity 20 m/s. The maximum height reached is: (g = 10 m/s²)",
    "options": [
      "10 m",
      "20 m",
      "30 m",
      "40 m"
    ],
    "correct_answer": "20 m",
    "explanation": "H = v²/2g = 400/20 = 20 m",
    "is_pyq": true,
    "pyq_year": 2019,
    "image_url": null
  },
  {
    "question_id": "phy-q-007",
    "exam": "NEET",
    "subject": "Physics",
    "unit": "Kinematics",
    "chapter": "Kinematics",
    "chapter_id": "phy-kinematics",
    "topic": "Kinematics",
    "type": "MCQ_SINGLE",
    "difficulty": "EASY",
    "question_text": "The velocity-time graph of uniform motion is a:",
    "options": [
      "Parabola",
      "Horizontal line",
      "Straight line through origin",
      "Vertical line"
    ],
    "correct_answer": "Horizontal line",
    "explanation": "In uniform motion, velocity is constant — the v-t graph is a horizontal straight line.",
    "is_pyq": false,
    "pyq_year": null,
    "image_url": null
  },
  {
    "question_id": "phy-q-008",
    "exam": "NEET",
    "subject": "Physics",
    "unit": "Kinematics",
    "chapter": "Kinematics",
    "chapter_id": "phy-kinematics",
    "topic": "Kinematics",
    "type": "MCQ_SINGLE",
    "difficulty": "EASY",
    "question_text": "Two vectors of magnitude 3 and 4 are perpendicular. Their resultant magnitude is:",
    "options": [
      "7",
      "5",
      "1",
      "3.5"
    ],
    "correct_answer": "5",
    "explanation": "R = √(3² + 4²) = √25 = 5",
    "is_pyq": false,
    "pyq_year": null,
    "image_url": null
  },
  {
    "question_id": "phy-q-009",
    "exam": "NEET",
    "subject": "Physics",
    "unit": "Kinematics",
    "chapter": "Kinematics",
    "chapter_id": "phy-kinematics",
    "topic": "Kinematics",
    "type": "MCQ_SINGLE",
    "difficulty": "EASY",
    "question_text": "A ball is dropped from height h. Time of flight is:",
    "options": [
      "√(h/g)",
      "√(2h/g)",
      "2√(h/g)",
      "h/g"
    ],
    "correct_answer": "√(2h/g)",
    "explanation": "h = ½gt² → t = √(2h/g)",
    "is_pyq": true,
    "pyq_year": 2020,
    "image_url": null
  },
  {
    "question_id": "phy-q-010",
    "exam": "NEET",
    "subject": "Physics",
    "unit": "Kinematics",
    "chapter": "Kinematics",
    "chapter_id": "phy-kinematics",
    "topic": "Kinematics",
    "type": "MCQ_SINGLE",
    "difficulty": "EASY",
    "question_text": "Relative velocity of two bodies moving in the same direction with speeds v1 and v2 (v1 > v2) is:",
    "options": [
      "v1 + v2",
      "v1 - v2",
      "v1 × v2",
      "v1 / v2"
    ],
    "correct_answer": "v1 - v2",
    "explanation": "Relative velocity = v1 - v2 when moving in the same direction.",
    "is_pyq": false,
    "pyq_year": null,
    "image_url": null
  },
  {
    "question_id": "phy-q-011",
    "exam": "NEET",
    "subject": "Physics",
    "unit": "Laws of Motion",
    "chapter": "Laws of Motion",
    "chapter_id": "phy-laws-of-motion",
    "topic": "Laws of Motion",
    "type": "MCQ_SINGLE",
    "difficulty": "EASY",
    "question_text": "Newton's first law of motion defines the concept of:",
    "options": [
      "Force",
      "Inertia",
      "Momentum",
      "Work"
    ],
    "correct_answer": "Inertia",
    "explanation": "Newton's first law (law of inertia) defines inertia — tendency of a body to remain in its state of rest or uniform motion.",
    "is_pyq": false,
    "pyq_year": null,
    "image_url": null
  },
  {
    "question_id": "phy-q-012",
    "exam": "NEET",
    "subject": "Physics",
    "unit": "Laws of Motion",
    "chapter": "Laws of Motion",
    "chapter_id": "phy-laws-of-motion",
    "topic": "Laws of Motion",
    "type": "MCQ_SINGLE",
    "difficulty": "EASY",
    "question_text": "A force of 10 N acts on a body of mass 2 kg. The acceleration produced is:",
    "options": [
      "5 m/s²",
      "10 m/s²",
      "20 m/s²",
      "2 m/s²"
    ],
    "correct_answer": "5 m/s²",
    "explanation": "a = F/m = 10/2 = 5 m/s²",
    "is_pyq": false,
    "pyq_year": null,
    "image_url": null
  },
  {
    "question_id": "phy-q-013",
    "exam": "NEET",
    "subject": "Physics",
    "unit": "Laws of Motion",
    "chapter": "Laws of Motion",
    "chapter_id": "phy-laws-of-motion",
    "topic": "Laws of Motion",
    "type": "MCQ_SINGLE",
    "difficulty": "EASY",
    "question_text": "A rocket works on the principle of:",
    "options": [
      "Newton's first law",
      "Newton's second law",
      "Newton's third law",
      "Conservation of energy"
    ],
    "correct_answer": "Newton's third law",
    "explanation": "In a rocket, exhaust gases are expelled backwards; reaction force propels the rocket forward — Newton's third law.",
    "is_pyq": true,
    "pyq_year": 2017,
    "image_url": null
  },
  {
    "question_id": "phy-q-014",
    "exam": "NEET",
    "subject": "Physics",
    "unit": "Laws of Motion",
    "chapter": "Laws of Motion",
    "chapter_id": "phy-laws-of-motion",
    "topic": "Laws of Motion",
    "type": "MCQ_SINGLE",
    "difficulty": "EASY",
    "question_text": "A block on a rough horizontal surface has coefficient of static friction 0.5. Maximum friction force if block weight is 20 N: (g=10)",
    "options": [
      "5 N",
      "10 N",
      "15 N",
      "20 N"
    ],
    "correct_answer": "10 N",
    "explanation": "f_max = μN = 0.5 × 20 = 10 N",
    "is_pyq": false,
    "pyq_year": null,
    "image_url": null
  },
  {
    "question_id": "phy-q-015",
    "exam": "NEET",
    "subject": "Physics",
    "unit": "Laws of Motion",
    "chapter": "Laws of Motion",
    "chapter_id": "phy-laws-of-motion",
    "topic": "Laws of Motion",
    "type": "MCQ_SINGLE",
    "difficulty": "EASY",
    "question_text": "Which law is the basis of conservation of linear momentum?",
    "options": [
      "Newton's first law",
      "Newton's second law",
      "Newton's third law",
      "All three"
    ],
    "correct_answer": "Newton's third law",
    "explanation": "Internal forces in a system are equal and opposite (Newton's 3rd law), so net impulse = 0, and total momentum is conserved.",
    "is_pyq": false,
    "pyq_year": null,
    "image_url": null
  },
  {
    "question_id": "phy-q-016",
    "exam": "NEET",
    "subject": "Physics",
    "unit": "Laws of Motion",
    "chapter": "Laws of Motion",
    "chapter_id": "phy-laws-of-motion",
    "topic": "Laws of Motion",
    "type": "MCQ_SINGLE",
    "difficulty": "MEDIUM",
    "question_text": "A gun fires a bullet of mass 50 g with velocity 200 m/s. If gun mass is 2 kg, recoil velocity is:",
    "options": [
      "5 m/s",
      "4 m/s",
      "3 m/s",